{
  "schema_version": "1.0.0",
  "suite_id": "DAST-LOCAL-001",
  "title": "Local runtime security contract",
  "requirements": ["REQ-SEC-001"],
  "base_url": "http://127.0.0.1:8000",
  "checks": [
    {
      "check_id": "DAST-HEADERS-001",
      "path": "/health",
      "method": "GET",
      "expected_status": 200,
      "required_headers": ["X-Content-Type-Options"]
    }
  ],
  "timeout_seconds": 3,
  "max_response_bytes": 1048576
}
